{
  "schema_version": "decision-board-shadow-gate.v0",
  "gate_version": "us-swing-shadow-v1-20260824",
  "horizon": "SWING",
  "approval": {
    "state": "PENDING",
    "approved_by": null,
    "approved_at": null,
    "approval_signature_sha256": null
  },
  "market": "US",
  "calendar": "XNYS",
  "start_session": "2026-08-24",
  "end_session": "2026-09-21",
  "minimum_sessions": 20,
  "sessions": [
    "2026-08-24",
    "2026-08-25",
    "2026-08-26",
    "2026-08-27",
    "2026-08-28",
    "2026-08-31",
    "2026-09-01",
    "2026-09-02",
    "2026-09-03",
    "2026-09-04",
    "2026-09-08",
    "2026-09-09",
    "2026-09-10",
    "2026-09-11",
    "2026-09-14",
    "2026-09-15",
    "2026-09-16",
    "2026-09-17",
    "2026-09-18",
    "2026-09-21"
  ],
  "lanes": [
    "ENTRY",
    "HOLDING"
  ],
  "policy_versions": {
    "compiler": "decision-policy.v0",
    "researcher": "evidence-researcher.v0",
    "verifier": "decision-board-claim-verifier-v0",
    "instrument_registry": "us-instrument-registry.v0"
  },
  "runtime_contract": {
    "code_revision": null,
    "artifact_digests": {
      "compiler": null,
      "researcher": null,
      "verifier": null,
      "instrument_registry": null
    },
    "source_provider_chain": [
      "finnhub",
      "polygon-news",
      "benzinga-news"
    ],
    "claim_model": "gpt-5.6-sol"
  },
  "evaluation_ledger": {
    "input_ledger_sha256": null,
    "expected_action_ledger_sha256": null,
    "case_count": 0
  },
  "schedule_policy": {
    "timezone": "UTC",
    "entry_expected_time": "12:30:00Z",
    "holding_expected_time": "22:40:00Z",
    "grace_seconds": 300,
    "stale_seconds": 1800
  },
  "expected_slots": [
    {
      "session": "2026-08-24",
      "run_kind": "ENTRY",
      "expected_at": "2026-08-24T12:30:00Z",
      "run_id": "entry-shadow-20260824"
    },
    {
      "session": "2026-08-24",
      "run_kind": "HOLDING",
      "expected_at": "2026-08-24T22:40:00Z",
      "run_id": "holding-shadow-20260824"
    },
    {
      "session": "2026-08-25",
      "run_kind": "ENTRY",
      "expected_at": "2026-08-25T12:30:00Z",
      "run_id": "entry-shadow-20260825"
    },
    {
      "session": "2026-08-25",
      "run_kind": "HOLDING",
      "expected_at": "2026-08-25T22:40:00Z",
      "run_id": "holding-shadow-20260825"
    },
    {
      "session": "2026-08-26",
      "run_kind": "ENTRY",
      "expected_at": "2026-08-26T12:30:00Z",
      "run_id": "entry-shadow-20260826"
    },
    {
      "session": "2026-08-26",
      "run_kind": "HOLDING",
      "expected_at": "2026-08-26T22:40:00Z",
      "run_id": "holding-shadow-20260826"
    },
    {
      "session": "2026-08-27",
      "run_kind": "ENTRY",
      "expected_at": "2026-08-27T12:30:00Z",
      "run_id": "entry-shadow-20260827"
    },
    {
      "session": "2026-08-27",
      "run_kind": "HOLDING",
      "expected_at": "2026-08-27T22:40:00Z",
      "run_id": "holding-shadow-20260827"
    },
    {
      "session": "2026-08-28",
      "run_kind": "ENTRY",
      "expected_at": "2026-08-28T12:30:00Z",
      "run_id": "entry-shadow-20260828"
    },
    {
      "session": "2026-08-28",
      "run_kind": "HOLDING",
      "expected_at": "2026-08-28T22:40:00Z",
      "run_id": "holding-shadow-20260828"
    },
    {
      "session": "2026-08-31",
      "run_kind": "ENTRY",
      "expected_at": "2026-08-31T12:30:00Z",
      "run_id": "entry-shadow-20260831"
    },
    {
      "session": "2026-08-31",
      "run_kind": "HOLDING",
      "expected_at": "2026-08-31T22:40:00Z",
      "run_id": "holding-shadow-20260831"
    },
    {
      "session": "2026-09-01",
      "run_kind": "ENTRY",
      "expected_at": "2026-09-01T12:30:00Z",
      "run_id": "entry-shadow-20260901"
    },
    {
      "session": "2026-09-01",
      "run_kind": "HOLDING",
      "expected_at": "2026-09-01T22:40:00Z",
      "run_id": "holding-shadow-20260901"
    },
    {
      "session": "2026-09-02",
      "run_kind": "ENTRY",
      "expected_at": "2026-09-02T12:30:00Z",
      "run_id": "entry-shadow-20260902"
    },
    {
      "session": "2026-09-02",
      "run_kind": "HOLDING",
      "expected_at": "2026-09-02T22:40:00Z",
      "run_id": "holding-shadow-20260902"
    },
    {
      "session": "2026-09-03",
      "run_kind": "ENTRY",
      "expected_at": "2026-09-03T12:30:00Z",
      "run_id": "entry-shadow-20260903"
    },
    {
      "session": "2026-09-03",
      "run_kind": "HOLDING",
      "expected_at": "2026-09-03T22:40:00Z",
      "run_id": "holding-shadow-20260903"
    },
    {
      "session": "2026-09-04",
      "run_kind": "ENTRY",
      "expected_at": "2026-09-04T12:30:00Z",
      "run_id": "entry-shadow-20260904"
    },
    {
      "session": "2026-09-04",
      "run_kind": "HOLDING",
      "expected_at": "2026-09-04T22:40:00Z",
      "run_id": "holding-shadow-20260904"
    },
    {
      "session": "2026-09-08",
      "run_kind": "ENTRY",
      "expected_at": "2026-09-08T12:30:00Z",
      "run_id": "entry-shadow-20260908"
    },
    {
      "session": "2026-09-08",
      "run_kind": "HOLDING",
      "expected_at": "2026-09-08T22:40:00Z",
      "run_id": "holding-shadow-20260908"
    },
    {
      "session": "2026-09-09",
      "run_kind": "ENTRY",
      "expected_at": "2026-09-09T12:30:00Z",
      "run_id": "entry-shadow-20260909"
    },
    {
      "session": "2026-09-09",
      "run_kind": "HOLDING",
      "expected_at": "2026-09-09T22:40:00Z",
      "run_id": "holding-shadow-20260909"
    },
    {
      "session": "2026-09-10",
      "run_kind": "ENTRY",
      "expected_at": "2026-09-10T12:30:00Z",
      "run_id": "entry-shadow-20260910"
    },
    {
      "session": "2026-09-10",
      "run_kind": "HOLDING",
      "expected_at": "2026-09-10T22:40:00Z",
      "run_id": "holding-shadow-20260910"
    },
    {
      "session": "2026-09-11",
      "run_kind": "ENTRY",
      "expected_at": "2026-09-11T12:30:00Z",
      "run_id": "entry-shadow-20260911"
    },
    {
      "session": "2026-09-11",
      "run_kind": "HOLDING",
      "expected_at": "2026-09-11T22:40:00Z",
      "run_id": "holding-shadow-20260911"
    },
    {
      "session": "2026-09-14",
      "run_kind": "ENTRY",
      "expected_at": "2026-09-14T12:30:00Z",
      "run_id": "entry-shadow-20260914"
    },
    {
      "session": "2026-09-14",
      "run_kind": "HOLDING",
      "expected_at": "2026-09-14T22:40:00Z",
      "run_id": "holding-shadow-20260914"
    },
    {
      "session": "2026-09-15",
      "run_kind": "ENTRY",
      "expected_at": "2026-09-15T12:30:00Z",
      "run_id": "entry-shadow-20260915"
    },
    {
      "session": "2026-09-15",
      "run_kind": "HOLDING",
      "expected_at": "2026-09-15T22:40:00Z",
      "run_id": "holding-shadow-20260915"
    },
    {
      "session": "2026-09-16",
      "run_kind": "ENTRY",
      "expected_at": "2026-09-16T12:30:00Z",
      "run_id": "entry-shadow-20260916"
    },
    {
      "session": "2026-09-16",
      "run_kind": "HOLDING",
      "expected_at": "2026-09-16T22:40:00Z",
      "run_id": "holding-shadow-20260916"
    },
    {
      "session": "2026-09-17",
      "run_kind": "ENTRY",
      "expected_at": "2026-09-17T12:30:00Z",
      "run_id": "entry-shadow-20260917"
    },
    {
      "session": "2026-09-17",
      "run_kind": "HOLDING",
      "expected_at": "2026-09-17T22:40:00Z",
      "run_id": "holding-shadow-20260917"
    },
    {
      "session": "2026-09-18",
      "run_kind": "ENTRY",
      "expected_at": "2026-09-18T12:30:00Z",
      "run_id": "entry-shadow-20260918"
    },
    {
      "session": "2026-09-18",
      "run_kind": "HOLDING",
      "expected_at": "2026-09-18T22:40:00Z",
      "run_id": "holding-shadow-20260918"
    },
    {
      "session": "2026-09-21",
      "run_kind": "ENTRY",
      "expected_at": "2026-09-21T12:30:00Z",
      "run_id": "entry-shadow-20260921"
    },
    {
      "session": "2026-09-21",
      "run_kind": "HOLDING",
      "expected_at": "2026-09-21T22:40:00Z",
      "run_id": "holding-shadow-20260921"
    }
  ],
  "allowed_diff_reasons": [
    "EXPECTED_POLICY_CHANGE",
    "INPUT_GAP",
    "SOURCE_GAP",
    "BUG",
    "UNEXPLAINED"
  ],
  "allowed_diff_reason_by_rule_id": {},
  "metric_definitions": {
    "provider_failure_rate": {
      "numerator": "provider_failed_attempts",
      "denominator": "provider_attempts",
      "zero_denominator": "NOT_APPLICABLE"
    },
    "research_coverage_rate": {
      "numerator": "eligible_items_with_verified_evidence",
      "denominator": "eligible_items",
      "zero_denominator": "NOT_APPLICABLE"
    },
    "fresh_source_rate": {
      "numerator": "fresh_verified_sources",
      "denominator": "verified_sources",
      "zero_denominator": "NOT_APPLICABLE"
    }
  },
  "approved_thresholds": {
    "hard_failures": {
      "unexplained": 0,
      "privacy_leaks": 0,
      "order_or_notification_accesses": 0,
      "payload_replay_mismatches": 0,
      "uncovered_eligible_holdings": 0,
      "hard_sell_regressions": 0,
      "invalid_publications": 0,
      "existing_pipeline_impacts": 0
    },
    "quality": {
      "provider_failure_rate_max": 0.05,
      "research_coverage_rate_min": 0.9,
      "fresh_source_rate_min": 0.9
    }
  }
}
